{
  "schemaVersion": "1.0.0",
  "meta": { "locale": "id", "mode": "ats", "template": "ats-default", "title": "Contoh Fresh Graduate" },
  "basics": {
    "name": "Rania Putri Maharani",
    "headline": "Fresh Graduate Teknik Informatika",
    "email": "rania.contoh@example.com",
    "phone": "+62 812-0000-0000",
    "location": "Ternate, Maluku Utara",
    "summary": "Lulusan Teknik Informatika dengan pengalaman organisasi kemahasiswaan dan proyek akhir di bidang pengembangan web. Terbiasa bekerja dalam tim kecil dan mengelola jadwal kegiatan.",
    "links": [{ "label": "LinkedIn", "url": "https://www.linkedin.com/in/contoh" }],
    "photo": { "enabled": true, "assetRef": "asset_sample_photo_01" }
  },
  "sections": {
    "education": [
      {
        "institution": "Universitas Contoh Nusantara",
        "degree": "S1 Teknik Informatika",
        "field": "Rekayasa Perangkat Lunak",
        "location": "Ternate",
        "startDate": "2021-08",
        "endDate": "2025-07",
        "status": "graduated",
        "gpa": { "value": "3.52", "scale": "4.00", "label": "IPK" },
        "highlights": ["Tugas akhir: sistem informasi pendataan UMKM berbasis web"]
      }
    ],
    "experience": [
      {
        "organization": "CV Contoh Digital",
        "role": "Magang Pengembang Web",
        "employmentType": "internship",
        "location": "Ternate",
        "startDate": "2024-07",
        "endDate": "2024-12",
        "current": false,
        "highlights": [
          "Membangun tiga halaman antarmuka untuk aplikasi pendataan internal",
          "Menyusun dokumentasi penggunaan aplikasi untuk staf non-teknis"
        ]
      }
    ],
    "organizations": [
      {
        "organization": "Himpunan Mahasiswa Teknik Informatika",
        "role": "Koordinator Divisi Acara",
        "employmentType": "organization",
        "startDate": "2023-01",
        "endDate": "2023-12",
        "current": false,
        "highlights": [
          "Mengkoordinasikan panitia beranggotakan 15 orang untuk seminar teknologi tingkat fakultas",
          "Menyusun rundown dan jadwal koordinasi mingguan selama masa persiapan"
        ]
      }
    ],
    "projects": [
      {
        "name": "Sistem Pendataan UMKM",
        "role": "Pengembang",
        "context": "Tugas akhir",
        "startDate": "2024-09",
        "endDate": "2025-06",
        "highlights": [
          "Merancang basis data dan antarmuka pendataan untuk 5 kategori usaha",
          "Menguji aplikasi bersama 8 pelaku usaha untuk mengumpulkan masukan"
        ]
      }
    ],
    "skills": [
      { "category": "Teknis", "items": ["JavaScript", "React", "HTML", "CSS", "Git", "MySQL"] },
      { "category": "Bahasa", "items": ["Bahasa Indonesia", "Bahasa Inggris (pasif)"] }
    ],
    "certifications": [
      {
        "name": "Belajar Dasar Pemrograman Web",
        "issuer": "Platform Pelatihan Contoh",
        "issueDate": "2024-03"
      }
    ]
  },
  "sectionOrder": ["education", "experience", "organizations", "projects", "skills", "certifications"]
}
